{
  "schema_version": 1,
  "adjudication_id": "mocc.validation.unseen_batch_1.adjudication",
  "manifest_id": "mocc.validation.unseen_batch_1",
  "freeze_id": "mocc.freeze.protocols_rules.2026_07_22",
  "status": "template",
  "label_set_ids": [
    "mocc.validation.unseen_batch_1.reviewer_a.labels",
    "mocc.validation.unseen_batch_1.reviewer_b.labels"
  ],
  "entries": [
    {
      "sample_id": "mocc.validation.a.ext4_fc_replay_create.v7_1",
      "final_verdict": "unlabeled",
      "adjudicator": "",
      "rationale": "",
      "reviewer_verdicts": {
        "reviewer_a": "unlabeled",
        "reviewer_b": "unlabeled"
      }
    },
    {
      "sample_id": "mocc.validation.a.ext4_fc_replay_link.v7_1",
      "final_verdict": "unlabeled",
      "adjudicator": "",
      "rationale": "",
      "reviewer_verdicts": {
        "reviewer_a": "unlabeled",
        "reviewer_b": "unlabeled"
      }
    },
    {
      "sample_id": "mocc.validation.a.xfs_rtmount_inodes.v7_1",
      "final_verdict": "unlabeled",
      "adjudicator": "",
      "rationale": "",
      "reviewer_verdicts": {
        "reviewer_a": "unlabeled",
        "reviewer_b": "unlabeled"
      }
    },
    {
      "sample_id": "mocc.validation.b.btrfs_setup_sprout.v6_14",
      "final_verdict": "unlabeled",
      "adjudicator": "",
      "rationale": "",
      "reviewer_verdicts": {
        "reviewer_a": "unlabeled",
        "reviewer_b": "unlabeled"
      }
    },
    {
      "sample_id": "mocc.validation.b.btrfs_reloc_post_snapshot.v6_14",
      "final_verdict": "unlabeled",
      "adjudicator": "",
      "rationale": "",
      "reviewer_verdicts": {
        "reviewer_a": "unlabeled",
        "reviewer_b": "unlabeled"
      }
    },
    {
      "sample_id": "mocc.validation.b.clean_dirty_subvols.v6_14",
      "final_verdict": "unlabeled",
      "adjudicator": "",
      "rationale": "",
      "reviewer_verdicts": {
        "reviewer_a": "unlabeled",
        "reviewer_b": "unlabeled"
      }
    },
    {
      "sample_id": "mocc.validation.c.ext4_try_to_expand_extra_isize.v6_14",
      "final_verdict": "unlabeled",
      "adjudicator": "",
      "rationale": "",
      "reviewer_verdicts": {
        "reviewer_a": "unlabeled",
        "reviewer_b": "unlabeled"
      }
    },
    {
      "sample_id": "mocc.validation.c.btrfs_chunk_alloc.v7_1",
      "final_verdict": "unlabeled",
      "adjudicator": "",
      "rationale": "",
      "reviewer_verdicts": {
        "reviewer_a": "unlabeled",
        "reviewer_b": "unlabeled"
      }
    },
    {
      "sample_id": "mocc.validation.d.xfs_set_acl.v7_1",
      "final_verdict": "unlabeled",
      "adjudicator": "",
      "rationale": "",
      "reviewer_verdicts": {
        "reviewer_a": "unlabeled",
        "reviewer_b": "unlabeled"
      }
    },
    {
      "sample_id": "mocc.validation.e.btrfs_get_name.v7_1",
      "final_verdict": "unlabeled",
      "adjudicator": "",
      "rationale": "",
      "reviewer_verdicts": {
        "reviewer_a": "unlabeled",
        "reviewer_b": "unlabeled"
      }
    }
  ]
}
